{
  "module": "markets",
  "issue_date": "2026-09-07",
  "window": {
    "start": "2026-08-31",
    "end": "2026-09-07"
  },
  "markets": {
    "gold": {
      "institutional_views": [
        {
          "institution": "World Gold Council",
          "original_title": "Weekly Markets Monitor - Talking tough",
          "published_at": "2026-09-01",
          "url": "https://www.gold.org/goldhub/gold-focus/2026/09/weekly-markets-monitor-talking-tough",
          "summary_zh": "世界黄金协会指出，美联储主席凯文·沃什在杰克逊霍尔释放更鹰派的政策信号后，市场迅速提高进一步紧缩的预期，两年期美国国债收益率上升，黄金随之跌破 200 日移动平均线，偏高的期权仓位也加重短期压力。与此同时，对伊朗制裁、贸易摩擦、美国通胀黏性和地缘政治风险仍在影响黄金。该机构认为，当前金价主要受到更高利率预期与避险需求之间的拉扯。"
        },
        {
          "institution": "UBS CIO",
          "original_title": "What can commodities add to a portfolio?",
          "published_at": "2026-09-02",
          "url": "https://www.ubs.com/global/en/wealthmanagement/insights/marketnews/article.3701819.html",
          "summary_zh": "瑞银首席投资办公室指出，黄金在 8 月约上涨 10%，此前受到通胀意外、地缘政治不确定性和主要发达经济体高财政赤字引发的货币贬值担忧支持。瑞银认为，央行购金、降低美元集中度以及全球债务问题仍是金价的长期结构性支撑，因此继续把黄金视为重要的战略分散工具，并对未来 12 个月保持积极。不过在快速上涨后，持仓较重的投资者可能需要重新平衡部分黄金敞口。"
        },
        {
          "institution": "Goldman Sachs",
          "original_title": "Why Gold Is Expected to Rise to Record Highs",
          "published_at": "2026-09-04",
          "url": "https://www.goldmansachs.com/insights/the-markets/why-gold-is-expected-to-rise-to-record-highs",
          "summary_zh": "高盛金属交易全球主管托尼·金认为，美国利率路径不确定以及伊朗战争造成的市场扰动，使黄金此前的涨势进入较长停顿期，但持续的央行购金仍可能成为推动金价重新创出高位的关键结构性力量。他同时指出，市场对财政可持续性的担忧可能提升黄金作为非主权储值资产的吸引力；另一方面，亚洲投资需求减弱正在削弱市场动能，是这一上行情景面临的重要下行风险。"
        }
      ]
    },
    "us_equities": {
      "institutional_views": [
        {
          "institution": "BlackRock",
          "original_title": "When Rates Begin to Bite",
          "published_at": "2026-08-31",
          "url": "https://www.blackrock.com/us/financial-professionals/insights/rates-begin-to-bite",
          "summary_zh": "贝莱德认为，美国股市迄今能够承受国债收益率上升，主要因为经济增长和企业盈利仍然强劲，尤其是科技公司盈利改善抵消了估值折现压力。但美国 10 年期国债收益率已接近历史上开始明显压制股票回报的区间；其研究显示，当收益率高出过去三年均值两个标准差以上时，标普 500 指数月度平均价格回报约为负 1.7%。若长端利率继续上行，即使基本面仍稳健，也可能逐步成为美股估值的重要约束。"
        },
        {
          "institution": "UBS CIO",
          "original_title": "What a more hawkish Fed means for investors",
          "published_at": "2026-09-04",
          "url": "https://www.ubs.com/global/en/wealthmanagement/insights/chief-investment-office/house-view/daily/2026/latest-04092026.html",
          "summary_zh": "瑞银首席投资办公室认为，美联储转向更鹰派并不必然推翻股票市场的中期前景，关键在于政策收紧发生时经济增长、就业和企业盈利是否仍具韧性。AI 相关资本开支与强劲盈利继续提供支撑；如果利率上升伴随增长和利润保持强势，风险资产仍可能处于有利环境。相反，如果通胀黏性迫使利率持续走高，同时经济增长转弱，股票估值和风险偏好才会面临更明显压力。"
        },
        {
          "institution": "HSBC Private Bank and Premier Wealth",
          "original_title": "Investment Monthly: Broadening earnings growth offsets bond yield volatility",
          "published_at": "2026-09-01",
          "url": "https://www.hsbc.com.hk/wealth/insights/asset-class-views/investment-monthly/broadening-earnings-growth-offsets-bond-yield-volatility/",
          "summary_zh": "汇丰私人银行继续超配美国股票，认为韧性的经济增长、强劲企业盈利和 AI 投资仍是主要支撑。第二季度盈利增长已从大型科技公司扩展至工业、金融等更多行业，使市场上涨不再完全依赖少数超大型科技股。汇丰同时指出，美国政府和大型科技企业增加债券供给可能继续造成收益率波动，但在盈利增长保持坚实的情况下，暂时不足以破坏股票市场的基本面支撑。"
        }
      ]
    },
    "china_equities": {
      "institutional_views": [
        {
          "institution": "HSBC Private Bank and Premier Wealth",
          "original_title": "Investment Outlook: HSBC Perspectives Q4 2026",
          "published_at": "2026-09-03",
          "url": "https://www.hsbc.com.hk/wealth/insights/market-outlook/investment-outlook/accelerating-ai-adoption-powers-further-upside-for-global-markets/",
          "summary_zh": "汇丰私人银行在第四季度展望中继续超配中国内地股票，认为政策支持、快速技术创新和开源 AI 模型正在巩固中国制造业优势，机器人、可再生能源、绿色技术、电动车和生物科技等先进制造领域提供主要增长机会。汇丰还认为公司治理改革有助于提高亚洲企业股本回报率，并预计香港市场也会受益于这些产业趋势；该判断覆盖中国内地与香港股票，而非仅指 A 股。"
        },
        {
          "institution": "HSBC Private Bank and Premier Wealth",
          "original_title": "Investment Monthly: Broadening earnings growth offsets bond yield volatility",
          "published_at": "2026-09-01",
          "url": "https://www.hsbc.com.hk/wealth/insights/asset-class-views/investment-monthly/broadening-earnings-growth-offsets-bond-yield-volatility/",
          "summary_zh": "汇丰私人银行在 9 月月度观点中继续超配中国内地与香港股票。对内地市场，其依据是政策对服务消费和基础设施的支持，以及科技自主和 AI 建设带来的科技、制造业龙头需求，同时以高质量股息股平衡创新板块风险。对香港市场，汇丰认为贸易流保持韧性、消费与房地产活动改善，信息技术和绿色产业也提供增长动力，并偏好银行、保险、电信、公用事业及优质地产企业。"
        },
        {
          "institution": "Invesco",
          "original_title": "Monthly Market Roundup covering August 2026",
          "published_at": "2026-09-02",
          "url": "https://www.invesco.com/content/dam/invesco/emea/en/pdf/mmr-sept-cov-aug-2026.pdf",
          "summary_zh": "景顺在 8 月市场回顾中指出，中国股票当月表现偏弱，主要受到国内需求疲软和政策支持有限的压制；制造业与服务业活动仅温和改善，持续偏低的通胀也反映消费仍较低迷。市场内部则存在分化，科技和医疗保健股票相对更具韧性，景顺将其归因于企业基本面改善和估值具有吸引力。该观点讨论的是中国市场整体及主要行业差异，而非仅针对 A 股或离岸中国股票。"
        }
      ]
    }
  }
}
